{
  "requirements_inventory": [
    {
      "ref": "HEALTH-1",
      "summary": "GET /health returns {\"status\":\"ok\"}, and a page shows that status (the page is the frontend's part; this backend plan covers the endpoint)."
    }
  ],
  "stack": {
    "summary": "Proposed: Node.js (>=18) using only the built-in http module, with no third-party dependencies. The target directory is empty and neither the requirements nor the configuration name a stack. A dependency-free Node server is the simplest common option for a single JSON endpoint: nothing to install, it starts fast, and unit tests run with the built-in node:test runner.",
    "source": "proposed",
    "conflicts": []
  },
  "runtime": {
    "install_command": "npm install",
    "start_command": "node server.js",
    "cwd": ".",
    "base_url": "http://127.0.0.1:8000",
    "ready_url": "http://127.0.0.1:8000/health",
    "openapi_path": "openapi.json",
    "unit_test_command": "node --test"
  },
  "milestones": [
    {
      "id": "M01",
      "title": "Health endpoint",
      "goal": "Add a runnable Node.js HTTP server whose GET /health endpoint returns {\"status\":\"ok\"} as JSON, and document it in openapi.json.",
      "depends_on": [],
      "tasks": [
        {
          "id": "M01-T01",
          "title": "Project scaffold",
          "description": "Create package.json (name, private, \"type\": \"commonjs\", scripts: start = \"node server.js\", test = \"node --test\") with no dependencies, so that `npm install` succeeds as a no-op.",
          "requirement_refs": [
            "HEALTH-1"
          ]
        },
        {
          "id": "M01-T02",
          "title": "HTTP server with GET /health",
          "description": "Create app.js, which exports a request handler, and server.js, which listens on process.env.PORT (default 8000) at host 127.0.0.1. GET /health answers 200 with Content-Type application/json and the body {\"status\":\"ok\"}. Any other path answers 404 with a JSON error body {\"error\":\"not found\"}. Any other method on /health answers 405 with a JSON error body and an Allow: GET header. Every response carries Access-Control-Allow-Origin: *, so a separately served status page can fetch the endpoint.",
          "requirement_refs": [
            "HEALTH-1"
          ]
        },
        {
          "id": "M01-T03",
          "title": "OpenAPI document",
          "description": "Create openapi.json (OpenAPI 3.0.3) that documents only GET /health, with a 200 response whose application/json schema is an object with a required string property `status` (enum [\"ok\"]) and example {\"status\":\"ok\"}.",
          "requirement_refs": [
            "HEALTH-1"
          ]
        },
        {
          "id": "M01-T04",
          "title": "Unit tests",
          "description": "Add test/health.test.js using node:test. It starts the handler on an ephemeral port and checks that GET /health returns 200 with the JSON body {\"status\":\"ok\"}, and that an unknown path returns 404.",
          "requirement_refs": [
            "HEALTH-1"
          ]
        }
      ],
      "acceptance_criteria": [
        {
          "id": "M01-AC1",
          "text": "GET http://127.0.0.1:8000/health responds with status 200, a Content-Type header starting with application/json, and a body that parses as JSON equal to {\"status\":\"ok\"}.",
          "requirement_refs": [
            "HEALTH-1"
          ]
        },
        {
          "id": "M01-AC2",
          "text": "The GET /health response includes the header Access-Control-Allow-Origin: *, so a status page served from another origin can read it.",
          "requirement_refs": [
            "HEALTH-1"
          ]
        },
        {
          "id": "M01-AC3",
          "text": "GET http://127.0.0.1:8000/does-not-exist responds with status 404 and a JSON error body.",
          "requirement_refs": [
            "HEALTH-1"
          ]
        },
        {
          "id": "M01-AC4",
          "text": "openapi.json is a valid OpenAPI 3 document whose paths contain exactly one operation, `get` on /health, with a 200 application/json response schema that has the property `status`.",
          "requirement_refs": [
            "HEALTH-1"
          ]
        }
      ]
    }
  ],
  "open_questions": [],
  "assumptions": [
    {
      "id": "A1",
      "text": "The \"page shows that status\" part of HEALTH-1 is a frontend concern and will be built by a frontend step. This backend plan covers only the GET /health endpoint. It adds a permissive CORS header so that page can call the endpoint from another origin.",
      "source": "HEALTH-1; backend-dev loop role"
    },
    {
      "id": "A2",
      "text": "The server listens on 127.0.0.1, on port 8000 by default, and the PORT environment variable can override the port. The requirements do not specify a host or port.",
      "source": "proposed"
    },
    {
      "id": "A3",
      "text": "The stack is proposed (dependency-free Node.js >= 18) because the target directory is empty and neither the requirements nor the configuration name a stack.",
      "source": "empty target_dir; configuration.backend is empty"
    },
    {
      "id": "A4",
      "text": "A 404 for unknown paths and a 405 for non-GET methods on /health are reasonable defaults. They do not add to the requirement or change it.",
      "source": "proposed"
    }
  ]
}
