{
  "requirements_inventory": [
    {
      "ref": "HEALTH-1",
      "summary": "A GET /health endpoint returns {\"status\":\"ok\"}, and a page shows that status. (Frontend scope: the page that calls GET /health and displays the status.)"
    }
  ],
  "stack": {
    "summary": "Target directory is empty and neither the requirements nor the configuration name a frontend stack. Proposed: a dependency-free static page (index.html + vanilla JS + CSS) served by a tiny Node.js built-in `http` server (server.js), matching the backend's zero-dependency Node/CommonJS style. The server also serves /config.js exposing the backend base URL from the BACKEND_BASE_URL env var (default http://127.0.0.1:8000, the configured backend), so the address is not hard-coded in page code. The page calls the backend directly via fetch; the backend already sends Access-Control-Allow-Origin: *. Unit tests use node --test.",
    "source": "proposed",
    "conflicts": []
  },
  "runtime": {
    "install_command": "true",
    "start_command": "node server.js",
    "cwd": ".",
    "base_url": "http://127.0.0.1:5173",
    "ready_url": "http://127.0.0.1:5173/",
    "unit_test_command": "node --test"
  },
  "milestones": [
    {
      "id": "M01",
      "title": "Service status page",
      "goal": "A user opening the frontend sees the backend's service status, fetched via the documented GET /health operation.",
      "depends_on": [],
      "tasks": [
        {
          "id": "M01-T01",
          "title": "Static server and runtime config",
          "description": "Create package.json (commonjs, scripts start/test) and server.js using Node's built-in http module, listening on 127.0.0.1:PORT (default 5173). Serve index.html at /, static app.js and styles.css, and a generated /config.js that sets window.APP_CONFIG = { backendBaseUrl } from env BACKEND_BASE_URL (default http://127.0.0.1:8000). Unknown paths return 404. The frontend server must not itself expose or proxy /health.",
          "requirement_refs": [
            "HEALTH-1"
          ]
        },
        {
          "id": "M01-T02",
          "title": "Status page UI",
          "description": "Create index.html with a heading 'Service status' and a status element (e.g. data-testid=\"service-status\") that initially reads 'Checking…'. app.js on load calls fetch(`${backendBaseUrl}/health`, { method: 'GET' }) only; on a 200 JSON response it shows the returned status value (e.g. 'ok') with an OK styling; on network error or non-2xx it shows 'unavailable' with an error message. No other backend calls.",
          "requirement_refs": [
            "HEALTH-1"
          ]
        },
        {
          "id": "M01-T03",
          "title": "Unit tests",
          "description": "Add node --test tests: server serves / with the status element, /config.js contains the configured backend URL, and a pure render/format function maps {status:'ok'} to the displayed 'ok' text and failures to 'unavailable'.",
          "requirement_refs": [
            "HEALTH-1"
          ]
        }
      ],
      "acceptance_criteria": [
        {
          "id": "M01-AC1",
          "text": "Opening http://127.0.0.1:5173/ in a browser shows a page with the heading 'Service status'.",
          "requirement_refs": [
            "HEALTH-1"
          ]
        },
        {
          "id": "M01-AC2",
          "text": "With the backend running, within a few seconds of load the status element on the page displays the text 'ok', taken from the GET /health response body's status field.",
          "requirement_refs": [
            "HEALTH-1"
          ]
        },
        {
          "id": "M01-AC3",
          "text": "The only backend request the page makes is GET http://127.0.0.1:8000/health (the documented getHealth operation); no undocumented endpoints are called.",
          "requirement_refs": [
            "HEALTH-1"
          ]
        },
        {
          "id": "M01-AC4",
          "text": "If the backend is unreachable, the status element shows 'unavailable' and an error message instead of staying on 'Checking…'.",
          "requirement_refs": [
            "HEALTH-1"
          ]
        }
      ]
    }
  ],
  "open_questions": [],
  "assumptions": [
    {
      "id": "A1",
      "text": "The target directory is empty, so a new dependency-free Node static server + vanilla JS page is an acceptable proposed stack.",
      "source": "Empty target_dir; no stack named in requirements or configuration"
    },
    {
      "id": "A2",
      "text": "The page calls the backend directly (cross-origin) at the configured backend_base_url; this works because the backend sets Access-Control-Allow-Origin: *.",
      "source": "Backend app.js sendJson headers; configuration.backend.base_url"
    },
    {
      "id": "A3",
      "text": "The frontend serves on 127.0.0.1:5173 (overridable via PORT) to avoid clashing with the backend on port 8000.",
      "source": "Proposed; configuration.backend.base_url uses port 8000"
    },
    {
      "id": "A4",
      "text": "Showing 'unavailable' plus an error message when the backend cannot be reached is a reasonable UI detail within HEALTH-1 and does not add a new requirement.",
      "source": "Interpretation of HEALTH-1 'a page shows that status'"
    },
    {
      "id": "A5",
      "text": "The displayed status text is the raw status value from the response ('ok'), rendered in a single element on the page.",
      "source": "HEALTH-1 and openapi.json getHealth response schema"
    }
  ]
}
