{
  "requirements_inventory": [
    {
      "ref": "COUNTER-1",
      "summary": "A page with a button that increments the counter (POST /counter/increment) and shows the current value (GET /counter returns {\"value\": n})."
    }
  ],
  "stack": {
    "summary": "Proposed: the target directory is empty and neither the requirements nor the configuration name a frontend stack. Use a static page (HTML, CSS, vanilla ES-module JavaScript) served by a small Node.js server that uses only built-in modules (node:http, node:fs), with tests run by node:test. It needs no dependencies or build step and matches the Node backend. The server also serves /config.js, which sets the backend base URL from the BACKEND_BASE_URL environment variable at run time. The browser calls the backend directly, which works because the backend sends Access-Control-Allow-Origin: *.",
    "source": "proposed",
    "conflicts": []
  },
  "runtime": {
    "install_command": "true",
    "start_command": "node server.js",
    "cwd": ".",
    "base_url": "http://127.0.0.1:8080/",
    "ready_url": "http://127.0.0.1:8080/",
    "unit_test_command": "node --test"
  },
  "milestones": [
    {
      "id": "M01",
      "title": "Counter page",
      "goal": "Serve one page that shows the current counter value from GET /counter and has a button that calls POST /counter/increment and shows the returned value.",
      "depends_on": [],
      "tasks": [
        {
          "id": "M01-T01",
          "title": "Static server with runtime config",
          "description": "Create package.json (type: module, with start and test scripts) and server.js. server.js uses node:http to serve index.html, app.js, api.js and styles.css from the target directory on PORT (default 8080) and host 127.0.0.1. It also serves /config.js, which sets window.APP_CONFIG = { backendBaseUrl } from the BACKEND_BASE_URL environment variable (default http://127.0.0.1:3000, the backend_base_url given in configuration). Unknown paths return 404.",
          "requirement_refs": [
            "COUNTER-1"
          ]
        },
        {
          "id": "M01-T02",
          "title": "API client limited to the spec's operations",
          "description": "api.js exports getCounter(), which sends GET {base}/counter, and incrementCounter(), which sends POST {base}/counter/increment with no body. Each one parses the JSON response and returns its integer value. A non-2xx response or a network failure throws an error. No other endpoints are called.",
          "requirement_refs": [
            "COUNTER-1"
          ]
        },
        {
          "id": "M01-T03",
          "title": "Counter UI",
          "description": "index.html has a heading 'Counter', a value display element (id=\"counter-value\", aria-live=\"polite\"), an 'Increment' button (id=\"increment-button\") and an error area (id=\"error\", role=\"alert\"). On load, app.js calls getCounter and shows the value; until then the display shows 'Loading…'. When the button is clicked, app.js disables the button, calls incrementCounter, shows the returned value, then enables the button again. If a request fails, the error area shows a readable message and the last value stays on screen.",
          "requirement_refs": [
            "COUNTER-1"
          ]
        },
        {
          "id": "M01-T04",
          "title": "Unit tests",
          "description": "Add node:test tests. They check that api.js calls the correct method and URL and parses {value}, using a stubbed global fetch, and that server.js serves index.html and a config.js that reflects BACKEND_BASE_URL.",
          "requirement_refs": [
            "COUNTER-1"
          ]
        }
      ],
      "acceptance_criteria": [
        {
          "id": "M01-AC1",
          "text": "Opening the base URL shows a page with a 'Counter' heading, an 'Increment' button, and a number that equals the value GET /counter returns (for example 0 on a freshly started backend).",
          "requirement_refs": [
            "COUNTER-1"
          ]
        },
        {
          "id": "M01-AC2",
          "text": "Clicking 'Increment' once sends exactly one POST /counter/increment to the backend, and the number on the page goes up by one to match the value in the response.",
          "requirement_refs": [
            "COUNTER-1"
          ]
        },
        {
          "id": "M01-AC3",
          "text": "Clicking 'Increment' three times makes the number go up by three. Reloading the page then shows the same number, fetched again with GET /counter.",
          "requirement_refs": [
            "COUNTER-1"
          ]
        },
        {
          "id": "M01-AC4",
          "text": "Every network request the page makes to the backend is either GET /counter or POST /counter/increment on the configured backend base URL. No other backend endpoint is requested.",
          "requirement_refs": [
            "COUNTER-1"
          ]
        },
        {
          "id": "M01-AC5",
          "text": "If the backend is unreachable when the page loads or when 'Increment' is clicked, the page shows a visible error message instead of failing silently.",
          "requirement_refs": [
            "COUNTER-1"
          ]
        }
      ]
    }
  ],
  "open_questions": [],
  "assumptions": [
    {
      "id": "A1",
      "text": "The frontend is served on 127.0.0.1:8080; the PORT environment variable overrides the port.",
      "source": "proposed; the configuration does not specify a frontend port"
    },
    {
      "id": "A2",
      "text": "The backend base URL is read at run time from the BACKEND_BASE_URL environment variable. If it is not set, the default is http://127.0.0.1:3000, the backend_base_url given in the context.",
      "source": "context.frontend.backend_base_url"
    },
    {
      "id": "A3",
      "text": "The browser calls the backend cross-origin with no proxy. The backend's server.js sends Access-Control-Allow-Origin: * and answers OPTIONS preflights.",
      "source": "existing backend code (backend/server.js)"
    },
    {
      "id": "A4",
      "text": "The page loads the current value with GET /counter when it opens, and after each click shows the value returned by POST /counter/increment. It does not call GET /counter again after incrementing.",
      "source": "COUNTER-1 and the openapi.json response schemas"
    },
    {
      "id": "A5",
      "text": "Showing an error message when a request fails, and disabling the button while a request is in flight, are basic UX. They do not add new requirements.",
      "source": "proposed"
    }
  ]
}
